{
 "agents": [
  {
   "cost": 22,
   "did": "Wake 13:00 London (fired 13:04 UTC); team at 0d81af7da975. Took in the researcher's pass 20261026T1208Z (pack vault 7r83qic5 at f12c7b82a7e8; queue 450 rows, 67 then pending). Promoted 18 sources into the evidence vault 3ytzxm3g (2 priority 2, 16 priority 4; now 525 sources), 20 claims, no timeline rows. Evidence…",
   "id": "curator-scheduled",
   "last": "2026-10-26T13:43Z",
   "member": "newsroom-lead",
   "name": "curator@php.newsroom (scheduled)",
   "on": "editor",
   "stage": "curator",
   "state": "working",
   "waiting": "The CLI team's answer on the slow first status and pull (curator-0001); the editor on oq9gflln. Its data-writes proposal goes to the journalist, correspondent and conductor for review before any trial."
  },
  {
   "cost": 14,
   "did": "Wake 14:30 London, 26 October: one pass of the source watch on the pack vault 7r83qic5, two phases each committed and pushed, vault in sync at head aa0d4d7f77a5, on sgit-ai v0.25.0. Cyber desk: neither CVE in the CISA KEV catalog; Metasploit and Sigma 0 merged pulls; the nuclei pulls series reads 0 though the page…",
   "id": "researcher-scheduled",
   "last": "2026-10-26T15:18Z",
   "member": "researcher",
   "name": "researcher@php.newsroom (scheduled)",
   "on": "",
   "stage": "researcher",
   "state": "working",
   "waiting": "A run record in git at every wake (your call: see the first decision)."
  },
  {
   "cost": 19.94,
   "did": "Measured the creator vault (580 MB, mostly captures) and the evidence vault; advises waiting before moving either to pack mode.",
   "id": "curator-first-session",
   "last": "2026-10-23T23:06Z",
   "member": "newsroom-lead",
   "name": "curator@php.newsroom (first session)",
   "on": "editor",
   "stage": "curator",
   "state": "review",
   "waiting": "A decision on moving the creator vault to pack mode (the agent advises waiting)."
  },
  {
   "cost": 101.97,
   "did": "Pack mode measured and written up; reviewed the old schedule vault. Asked whether to leave four notes for the conductor or wait until the old vault key is rotated and handed over sealed.",
   "id": "researcher-first-session",
   "last": "2026-10-23T22:57Z",
   "member": "researcher",
   "name": "researcher@php.newsroom (first session)",
   "on": "editor",
   "stage": "researcher",
   "state": "review",
   "waiting": "Whether the old source vault (oq9gflln) key is rotated and handed over sealed."
  },
  {
   "cost": 181,
   "did": "Blocked on a Bash permission prompt (since 11:52 UTC, asked again 16:45).",
   "id": "dev",
   "last": "2026-10-24T16:45Z",
   "member": "dev",
   "name": "dev@php.newsroom",
   "on": "editor",
   "stage": "",
   "state": "blocked",
   "waiting": "Approve or deny the Bash call in its session; desk lists 6 decisions waiting on you."
  },
  {
   "cost": 91,
   "did": "Wakes on schedule; both lanes empty; next 07:45.",
   "id": "sherpa",
   "last": "2026-10-24T20:47Z",
   "member": "sherpa",
   "name": "sherpa@php.newsroom",
   "on": "editor",
   "stage": "",
   "state": "waiting",
   "waiting": "The conductor's lane key (5iwos28w) and the subscriptions key (wgeiqabu) handed over sealed."
  },
  {
   "cost": 54,
   "did": "Lens UI prototype built and checked; board 274 closed.",
   "id": "designer",
   "last": "2026-10-24T13:38Z",
   "member": "story-site",
   "name": "designer@php.newsroom",
   "on": "editor",
   "stage": "",
   "state": "waiting",
   "waiting": "Its agent key enrolled; the picks on board 138."
  },
  {
   "cost": 28,
   "did": "Pulse pass 20261026T145452Z (14:52 London); sgit-ai 0.25.0 (upgraded 26 Oct, per the conductor's note): whole pass 723 s for 441 pages (344 checked, 230 changed), commit and push to the pack vault 9f5knw9r in one try, vault head 1fe31d24a3ef, in sync with the server. Team dev 828a2c9ac194 recorded. Evidence: no…",
   "id": "pulse",
   "last": "2026-10-26T15:07Z",
   "member": "",
   "name": "pulse@newsroom",
   "on": "editor",
   "stage": "",
   "state": "working",
   "waiting": "Your go on those four; its card is not released yet."
  },
  {
   "cost": 20,
   "did": "Afternoon check done (run record 16:20). Lists 6 decisions for you, starting with dev's stuck prompt.",
   "id": "desk",
   "last": "2026-10-24T15:32Z",
   "member": "",
   "name": "desk@php.newsroom",
   "on": "editor",
   "stage": "desk",
   "state": "waiting",
   "waiting": "Your 6 ranked decisions; its scope."
  },
  {
   "cost": 30.06,
   "did": "Six readers public-read; the workflow removal was merged to dev.",
   "id": "synthetic",
   "last": "2026-10-24T00:23Z",
   "member": "synthetic",
   "name": "synthetic@php.newsroom",
   "on": "",
   "stage": "",
   "state": "done",
   "waiting": "nothing, apart from branches still open (see branches)"
  },
  {
   "cost": 17.44,
   "did": "The GRC section and the data protection officer's briefing (v0.6.0).",
   "id": "grc",
   "last": "2026-10-22T21:45Z",
   "member": "grc",
   "name": "grc@php.newsroom",
   "on": "editor",
   "stage": "",
   "state": "done",
   "waiting": "Board 092 (the editor: accept, fund or fix the newsroom's own risks), 093 (journalist), 094 (story-site)."
  },
  {
   "cost": 96,
   "did": "12:52 London wake (sgit 0.25.0; the desk's pack copy hsmfer5w is at 94352a55fbaa, BEHIND the curator's vault at a7ab84771dfc, so this wake read the loose evidence clone, pulled to a7ab84771dfc): release-time re-graded A5 holds on the release manager's timeline; no-confirmed-compromise holds A4 as of 09:40 UTC on 26…",
   "id": "factcheck",
   "last": "2026-10-26T13:30Z",
   "member": "verifier",
   "name": "factcheck@php.newsroom",
   "on": "",
   "stage": "",
   "state": "working",
   "waiting": "nothing"
  },
  {
   "cost": 47,
   "did": "Its 07:13 pass is running now.",
   "id": "librarian",
   "last": "2026-10-25T07:13Z",
   "member": "librarian",
   "name": "librarian@php.newsroom",
   "on": "editor",
   "stage": "librarian",
   "state": "working",
   "waiting": "Two board decisions; security review of its CLAUDE.md branch."
  },
  {
   "cost": 5.27,
   "did": "Agent behaviour policies, uncommitted: its own guard hook blocks every tool call.",
   "id": "abp",
   "last": "2026-10-22T19:58Z",
   "member": "",
   "name": "abp@newsroom.sgit",
   "on": "editor",
   "stage": "",
   "state": "blocked",
   "waiting": "The editor to turn the repository's hooks off in that session so it can commit and push its branch; the work exists only in its container."
  },
  {
   "cost": 15.13,
   "did": "The deck as HTML slides with a PDF (16 pages), on its branch.",
   "id": "storyboards",
   "last": "2026-10-22T19:57Z",
   "member": "",
   "name": "storyboards@php.newsroom",
   "on": "editor",
   "stage": "",
   "state": "waiting",
   "waiting": "A model key for four images; it must arrive sealed (pki.sgit.ai), not pasted."
  },
  {
   "cost": 66,
   "did": "Its first pass (14:40, run record 21:50 UTC): the Wikipedia php2shell article graph is live (v0.17.1).",
   "id": "ontologist-cartographer",
   "last": "2026-10-24T23:24Z",
   "member": "cartographer",
   "name": "ontologist@php.newsroom (cartographer)",
   "on": "",
   "stage": "ontologist",
   "state": "done",
   "waiting": "nothing"
  },
  {
   "cost": 2.21,
   "did": "\"Corrections we have asked for\" at /outreach/, on its branch; nothing sent to any outlet.",
   "id": "liaison-outreach",
   "last": "2026-10-22T19:27Z",
   "member": "",
   "name": "liaison@php.newsroom (outreach)",
   "on": "editor",
   "stage": "",
   "state": "waiting",
   "waiting": "Which sender, approval per message or a standing rule; a change to the security requirements; a key pair of its own."
  },
  {
   "cost": 70,
   "did": "CodeQL fixes done (first scan triaged and hardened, v0.15.12); gate-pass-2 now 5 commits ahead of dev.",
   "id": "security",
   "last": "2026-10-24T22:05Z",
   "member": "",
   "name": "security@php.newsroom",
   "on": "editor",
   "stage": "",
   "state": "waiting",
   "waiting": "Reply go to release security/gate-pass-2 (it carries the #4-6 fix); dismiss CodeQL alerts #3 and #22 yourself."
  },
  {
   "cost": 2,
   "did": "The editor's decision recorded (records/briefs/2026-10-26__decision__the-curator-writes-data.md): the curator may write the data files it works on, after a documented proposal reviewed and agreed by the journalist, the correspondent and the conductor, then a trial; the same path for any agent taking on a new write.…",
   "id": "conductor",
   "last": "2026-10-26T14:33Z",
   "member": "conductor",
   "name": "conductor@php.newsroom",
   "on": "editor",
   "stage": "",
   "state": "working",
   "waiting": "ROUND_TOKEN; wiring security, then the ontologist, librarian, desk and Sherpa."
  },
  {
   "cost": 11,
   "did": "A debrief released. Board rows 270 to 273.",
   "id": "observability",
   "last": "2026-10-24T12:22Z",
   "member": "observability",
   "name": "observability@php.newsroom",
   "on": "editor",
   "stage": "",
   "state": "waiting",
   "waiting": "The SG/Send access token (board 273); a decision on re-keying 84wr8mib; its key enrolled; the roster row."
  },
  {
   "cost": 13,
   "did": "Pages updated; term check clean; sgit doc 05 linked, not copied.",
   "id": "sharness-cli",
   "last": "2026-10-24T17:57Z",
   "member": "",
   "name": "sharness (cli)",
   "on": "",
   "stage": "",
   "state": "done",
   "waiting": "nothing"
  },
  {
   "cost": 114,
   "did": "Scheduled wake 14:25 London (fired 14:26 UTC), in this session (Opus); team dev at af89cbba07e1. Reviewed the journalist's 13:40 wake, data v0.1.30 (vault 22a0c2920b88, 525 sources, latest capture 12:14 UTC 26 Oct; 20 verdicts: 3 used, 5 agrees, 5 noted, 7 held back; offline rows Netherlands (AG Connect, full list as…",
   "id": "correspondent-scheduled",
   "last": "2026-10-26T14:43Z",
   "member": "correspondent",
   "name": "correspondent@php.newsroom (scheduled)",
   "on": "editor",
   "stage": "correspondent",
   "state": "working",